{
  "command_authority_granted": false,
  "commerce_mode": "ZERO_PRICE_SHADOW",
  "created_at": "2026-08-31T08:10:10Z",
  "execute_repository_code": false,
  "external_effect_authorized": false,
  "home_repository": "Hawkar-usls/Hawkar-usls",
  "market_repository": "Hawkar-usls/JANUS-MACHINE-MARKET",
  "money_enabled": false,
  "packet_hash": "94831d09df4169909ab5ba467408d7b66adc2bc799167cac3b959f8c15ffd014",
  "packet_id": "rap-shadow-6294ad1340631079bba8a89f6cdcb0a79507b8a6a60afb64",
  "payment_reference": null,
  "purchase_grant": {
    "execution_authority_granted": false,
    "purchase_id": "pur-ra-shadow-2c2c1a35f8de9bb8485d7df4d9a07902",
    "reasons": [
      "ZERO_PRICE_SHADOW_SERVICE_TEST",
      "PAYMENT_NOT_REQUIRED",
      "HOME_ADMISSION_REQUIRED"
    ],
    "schema": "janus.machine_market.purchase_grant.v1",
    "service_entitlement": {
      "bounds": {
        "max_blob_files": 24,
        "max_total_blob_bytes": 750000,
        "max_tree_entries": 5000
      },
      "execute_repository_code": false,
      "read_only": true,
      "ref": "main",
      "repository": "Hawkar-usls/JANUS-MACHINE-MARKET",
      "service": "JANUS.REPO_AUDIT"
    },
    "sku": "JANUS.REPO_AUDIT",
    "status": "PURCHASE_ELIGIBLE"
  },
  "purchase_grant_hash": "90b29edb0966222a9cc3fff84696f8ddf2a2fd6e2b1ab4eb012183350e02b9dd",
  "repository_write_authorized": false,
  "return_route": {
    "repository": "Hawkar-usls/JANUS-MACHINE-MARKET",
    "source_issue_id": 5297951015,
    "source_issue_number": 15
  },
  "schema": "janus.machine_market.home_repo_audit_packet.v1",
  "service_request": {
    "audit_scope": "BOUNDED_STATIC_REPOSITORY_SURFACE",
    "bounds": {
      "max_blob_files": 24,
      "max_total_blob_bytes": 750000,
      "max_tree_entries": 5000
    },
    "buyer_actor_id": "github:Hawkar-usls",
    "command_authority_granted": false,
    "execute_repository_code": false,
    "external_effect_authorized": false,
    "read_only": true,
    "ref": "main",
    "repository": "Hawkar-usls/JANUS-MACHINE-MARKET",
    "request_hash": "59f2b823269e81921368207bdd086510aa87cbdd07fd2a3b8d84f4a3c2222784",
    "request_id": "ra-shadow-c077b2c3052f4d63d4706b055fb3d3529e49d77c94b03ef7",
    "schema": "janus.market_service.repo_audit_request.v1",
    "sku": "JANUS.REPO_AUDIT"
  },
  "service_request_hash": "59f2b823269e81921368207bdd086510aa87cbdd07fd2a3b8d84f4a3c2222784",
  "sku": "JANUS.REPO_AUDIT"
}
